,Nombre,Anyo Nacimiento,Conocido Por,Que hace,Premios ganados
0,Kim Soss,No info,"Shulie, Interkosmos, No info","Reparto, Direccion de arte, Diseno de produccion",0
1,Marco Ricca,1962,"Cabeca a Premio, Crime Delicado, El Invasor","Reparto, Produccion, Guion",12
2,Mireia Aixala,No info,"Cuando los amos duermen, Transeuntes, Mamifera",Reparto,0
3,Hector Atienza,No info,"La Riera, Diarios de la webcam, La Lona",Reparto,0
4,Carlota Benet,No info,"Transeuntes, Terra baixa, The weekly mag",Reparto,0
5,Amaury Brigante,No info,"Transeuntes, La maniobra de Heimlich, No info",Reparto,0
6,Manuel Bronchud,No info,"[REC], Estambul 65, La mentira tiene cabellos rojos",Reparto,0
7,Ezra Miller,1992,"Las ventajas de ser un marginado, Tenemos que hablar de Kevin, Liga de la Justicia","Reparto, Produccion, Direccion",10
8,Tom Hiddleston,1981,"Los Vengadores, Thor, Thor: El mundo oscuro","Reparto, Produccion, Banda sonora",11
9,Dev Patel,1990,"Slumdog Millionaire, Monkey Man, Lion","Reparto, Produccion, Direccion",25
10,Don Cheadle,1964,"Crash (Colision), El irlandes, Hotel Rwanda","Reparto, Produccion, Direccion",38
11,Eddie Redmayne,1982,"Los miserables, La teoria del todo, La chica danesa","Reparto, Produccion, Banda sonora",26
12,Vinod Khanna,1946,"Dilwale, Qurbani, Dabangg","Reparto, Musica, Produccion",3
13,Chal McDonnell,No info,"Rosie & Me, No info, No info",Reparto,0
14,Orsolya Kiraly,No info,"Zold feny, Indifference, Feher farkas",Reparto,0
15,Bela Stubnya,no info,"P.S.O: In the Name of My Father, Gengszterfilm, Bet on Revenge","Reparto, Equipos adicionales",0
16,Daniel Bodis,No info,"Akarsz-e jatszani?, Szelfi Egyetem, Zold feny","Reparto, Guion, Camara y electricidad",0
17,Lluis Perez,No info,"Jovenes, Rotten Rain, Merli. Sapere Aude",Reparto,0
18,Pere Palau,No info,"No info, No info, No info",Reparto,0
19,Ramesh Juglan,No info,"Dangebaaz, No info, No info","Reparto, Produccion",0
20,Neha Kapoor,No info,"Enthiran, Mimamsa, Dangebaaz",Reparto,0
21,Mahesh Raaj,1953,"Hulchul, Jahan Jaaeyega Hamen Paaeyega, Yaar Gaddar",Reparto,0
22,Amitabh Bachchan,1942,"Black, Mohabbatein, Pink","Reparto, Produccion, Guion",103
23,Ewan McGregor,1971,"Moulin Rouge, Trainspotting, Agosto","Reparto, Produccion, Guion",36
24,Gemma Arterton,1986,"Prince of Persia: Las arenas del tiempo, Byzantium, Melanie: La chica con todos los dones","Reparto, Produccion, Banda sonora",2
25,Yana Drouz,1956,"28:94 Local Time, Ryadom, Tak erkir, tsurt dzmer","Reparto, Direccion, Guion",0
26,Karen Dzhanibekyan,1937,"Gaghtni khorhrdakane, Trinadtsatyy apostol, Baghdasare bazhanvum e knojits",Reparto,0
27,Heghine Hovhannisyan,No info,"28:94 Local Time, Tak erkir, tsurt dzmer, No info",Reparto,0
28,Vigen Stepanyan,No info,"Thank You, Dad, Light Drops, Znak Vechnosti","Reparto, Guion",0
29,Josh Brolin,1968,"Vengadores: Endgame, No es pais para viejos, Vengadores: Infinity War","Reparto, Produccion, Direccion",21
30,Andrew Garfield,1983,"Hasta el ultimo hombre (Hacksaw Ridge), The Amazing Spider-Man, La red social","Reparto, Produccion, Banda sonora",39
31,Zoe Saldana,1978,"Guardianes de la Galaxia, Avatar, Star Trek","Reparto, Produccion, Guion",20
32,Geoffrey Lewis,1935,"Secuestro infernal, Un botin de 500.000 dolares, Los renegados del diablo","Reparto, Guion, Direccion",2
33,Rachel Lloyd,No info,"Gangster Kittens, Brash Young Turks, No info",Reparto,0
34,Julian Glover,1935,"Indiana Jones y la ultima cruzada, El imperio contraataca, Troya","Reparto, Banda sonora",2
35,Alexander Skarsgard,1976,"La leyenda de Tarzan, Big Little Lies, True Blood","Reparto, Produccion, Direccion",15
36,Ernie Hudson,1945,"Los Cazafantasmas, The Family Business, Los Cazafantasmas II","Reparto, Produccion, Guion",4
37,Vincent D'Onofrio,1959,"Men in Black (Hombres de negro), La celda, La chaqueta metalica","Reparto, Produccion, Direccion",13
38,Raimundo Amador,No info,"Cenizas del paraiso, Se buscan fulmontis, ?Por que se frotan las patitas?","Reparto, Composicion, Musica",0
39,Cristiana Capotondi,1980,"La peggior settimana della mia vita, Come tu mi vuoi, Notte prima degli esami","Reparto, Equipos adicionales, Direccion",7
40,Pratyusha Banerjee,1991,"Balika Vadhu, Comedy Classes, Gulmohar Grand",Reparto,6
41,Christelle Dumas,No info,"Le sang de la haine, No info, No info",Reparto,0
42,July Morel,No info,"Bacchanalia, C'etait nous, Violet","Reparto, Guion, Direccion",0
43,Lollusabha Manohar,No info,"Velayudham, Sigaram Thodu, Alex Pandian",Reparto,0
44,R. Pandiaraajan,No info,"Doubles, Perarasu, Aan Paavam","Reparto, Direccion",0
45,Meosha Bean,1990,"Green Height Point, Anatomy of an Antihero: Redemption, Anatomy of An Antihero 4 redemption","Direccion, Direccion de fotografia y camara, Edicion",18
46,R. Pandiaraajan,No info,"Doubles, Perarasu, Aan Paavam","Reparto, Direccion",0
47,Joe Dempsie,1987,"Skins, Juego de tronos, Blitz","Reparto, Banda sonora",0
48,R. Pandiaraajan,No info,"Doubles, Perarasu, Aan Paavam","Reparto, Direccion",0
49,Joe Dempsie,1987,"Skins, Juego de tronos, Blitz","Reparto, Banda sonora",0
50,R. Pandiaraajan,No info,"Doubles, Perarasu, Aan Paavam","Reparto, Direccion",0
51,Adam Greaves-Neal,No info,"El joven mesias, Johnny English de nuevo en accion, Sherlock",Reparto,2
52,R. Pandiaraajan,No info,"Doubles, Perarasu, Aan Paavam","Reparto, Direccion",0
53,Hannah Boyan,No info,"Trade Off, No info, No info",Reparto,0
54,Mehdi Aliyev,No info,"Kendistan 2, Unfriended, No info",Reparto,0
55,Chad Ruhle,No info,"Night of the Coconut, What If Wes Anderson Directed X-Men?, What If Sergio Leone Directed the Punisher?",Reparto,0
56,Lucia Cammalleri,No info,"Sara May, Bambina, Respira, prova (Breathe, Try)",Reparto,0
57,Giorgia Coco,No info,"Bambina, No info, No info",Reparto,0
58,Brandon Perez,No info,"Hope, De espaldas a la ley, Transmission","Equipos adicionales, Reparto, Edicion",0
59,Bayingburd,No info,"Wuzhumuqin de hai zi, No info, No info",Reparto,0
60,Oyunsodo,No info,"Wuzhumuqin de hai zi, No info, No info",Reparto,0
61,Helen Chan,No info,"Quan jia fu, No info, No info",Reparto,0
62,Samuel Hui,1948,"Swordsman, Mad Mission, La leyenda de la perla dorada","Reparto, Musica, Composicion",0
63,Luis Alarcon,1929,"Estupido Cupido, La fiera, Tempano","Reparto, Efectos especiales, Produccion",4
64,Oyunsodo,No info,"Wuzhumuqin de hai zi, No info, No info",Reparto,0
65,Anthony Harrison,1961,"Joe Finds Grace, Somos los mejores: Una nueva era, Exuvia","Reparto, Produccion, Guion",2
66,Oyunsodo,No info,"Wuzhumuqin de hai zi, No info, No info",Reparto,0
67,Tama Soble,No info,"Reading Between the Lines, No info, No info",No info,0
68,Jeffery Aarles,No info,"Reading Between the Lines, No info, No info",No info,0
69,Callum Turner,1990,"Cancion de Nueva York, Green Room, Assassin's Creed","Reparto, Direccion, Guion",0
70,Jeffery Aarles,No info,"Reading Between the Lines, No info, No info",No info,0
71,Alicia Vikander,1988,"Ex_Machina, La chica danesa, Operacion U.N.C.L.E.","Reparto, Produccion, Banda sonora",55
72,Jeffery Aarles,No info,"Reading Between the Lines, No info, No info",No info,0
73,Matt Damon,1970,"El indomable Will Hunting, Marte (The Martian), Infiltrados","Produccion, Reparto, Guion",40
74,Jeffery Aarles,No info,"Reading Between the Lines, No info, No info",No info,0
75,Matilda Anna Ingrid Lutz,1991,"Revenge, Rings, Reptiles",Reparto,0
76,Jeffery Aarles,No info,"Reading Between the Lines, No info, No info",No info,0
77,Richard Pochinko,No info,"Reading Between the Lines, No info, No info",No info,0
