,nombre_actor,anyo_nac,conocido_por,que_hace,premios_ganados
0,Horatiu Malaele,1952,"Boda muda, Moromete Family: On the Edge of Time, Funeralii fericite","Reparto, Direccion, Guion",no info
1,Mireia Aixala,No info,"Cuando los amos duermen, Transeuntes, Mamifera",Reparto,No ha ganado premios
2,Hector Atienza,No info,"La Riera, Diarios de la webcam, La Lona",Reparto,No ha ganado premios
3,Carlota Benet,No info,"Transeuntes, Terra baixa, The weekly mag",Reparto,No ha ganado premios
4,Amaury Brigante,No info,"Transeuntes, La maniobra de Heimlich, No info",Reparto,No ha ganado premios
5,Manuel Bronchud,No info,"[REC], Estambul 65, La mentira tiene cabellos rojos",Reparto,no info
6,Michael Troude,No info,"Sin tiempo para morir, Danny the Dog, Distrito 13","Especialistas, Reparto",no info
7,Paul Rudd,1969,"Ant-Man, Ant-Man y la Avispa, Te quiero, tio","Reparto, Produccion, Guion",9
8,Kevin Hart,1979,"Vaya patrulla, Un espia y medio, La gran revancha","Produccion, Guion, Reparto",20
9,Maxime Seguin-Durand,No info,"Ceci n'est pas un polar, Publicite SAAQ - campagne publicitaire sur les drogues au volant (Pigeon), No info",Reparto,No ha ganado premios
10,Marina Janhunen Calderon,No info,"Star Wars: The Dark Empire, Star Wars: Qui-Gon Jinn III, Nemesis de Clank","Reparto, Produccion, Camara y electricidad",No ha ganado premios
11,Emilio Janhunen Calderon,No info,"Nemesis de Clank, Rinoplasticos: A Warrior's Journey, Clank and Goldscar","Reparto, Direccion, Produccion",No ha ganado premios
12,Alvaro Calderon Sr.,No info,"El Resplandor del Brillante en los Ojos Dormidos en La Mariguana, Rinoplasticos III, Rinoplasticos IV","Reparto, Guion, Produccion",No ha ganado premios
13,Andres Calderon,No info,"Rinoplasticos: A Warrior's Journey, Rinoplasticos III, Clank: El mosaico rojo","Reparto, Direccion de fotografia y camara, Produccion",No ha ganado premios
14,Hendra Gunawan,No info,"Sisi Manis, Rajawali, No info",Reparto,No ha ganado premios
15,Jack Porter,No info,"Let's Kill Mom, The Fast One, The Bay House","Camara y electricidad, Produccion, Reparto",no info
16,Heath Bolton,No info,"What Doesn't Kill Us, Jeremy, A Short Film About Short Films",Reparto,No ha ganado premios
17,Buddy Ketelle,No info,"Let's Kill Mom, Burrito Tuesday!, Jeff and Jeffrey","Guion, Direccion, Edicion",No ha ganado premios
18,Joshua Faust,No info,"The Hungry Buddhists, No info, No info",Reparto,No ha ganado premios
19,Josh Brolin,1968,"Vengadores: Endgame, No es pais para viejos, Vengadores: Infinity War","Reparto, Produccion, Direccion",21
20,Joey Cummings,No info,"Have You Seen Me?, No info, No info",Reparto,No ha ganado premios
21,Clarence Phillpot,No info,"Have You Seen Me?, No info, No info",Reparto,No ha ganado premios
22,Chris Elwood,No info,"Buen rollito, Ringer, My Dinner with Jimi","Reparto, Guion",No ha ganado premios
23,Eddie Daniels,1967,"Teniente corrupto, Ken Park, Manhattan Minutiae","Reparto, Direccion de produccion, Produccion",No ha ganado premios
24,Sarah Maria Newman,No info,"Girls! Girls! Girls!, Manhattan Minutiae, How to Have a Happy Marriage","Reparto, Produccion, Equipos adicionales",no info
25,Allie Marie Evans,1996,"El viaje de Max, 47 Hours, Chapter 51",Reparto,No ha ganado premios
26,Patrick Johnson,No info,"Sabotage, Mas alla del amor, Terapia de choque","Reparto, Camara y electricidad, Produccion",no info
27,Paul Reubens,1952,"Pee-wee's Playhouse, La gran aventura de Pee-wee, El gran Pee-Wee","Reparto, Guion, Direccion",6
28,Clarence Phillpot,No info,"Have You Seen Me?, No info, No info",Reparto,No ha ganado premios
29,Geoffrey Lewis,1935,"Secuestro infernal, Un botin de 500.000 dolares, Los renegados del diablo","Reparto, Guion, Direccion",2
30,Clarence Phillpot,No info,"Have You Seen Me?, No info, No info",Reparto,No ha ganado premios
31,Tamara Bruketta,No info,"Baked Goods, Hey Ash, Whatcha Playin'?, The Search","Reparto, Guion, Produccion",No ha ganado premios
32,Tybee Diskin,No info,"V/H/S/99, Fallout: Nuka Break, the Series, Vain: This Party Sucks","Reparto, Direccion de casting, Produccion",No ha ganado premios
33,Benji Dolly,No info,"Video Game High School, Champion of Glory, Dimension 404","Reparto, Edicion, Produccion",No ha ganado premios
34,Kathryn Farr,No info,"Pool Fart, No info, No info",Reparto,No ha ganado premios
35,Tristan Gregson,No info,"Attack of the Doc!, Pool Fart, No info","Reparto, Produccion",No ha ganado premios
36,Alivia Marie,No info,"Hovid Povid, Pool Fart, Don't You Know?",Reparto,no info
37,Jewel Greenberg,No info,"96 Souls, Heaven's Renegade Angel, No sabia que estaba embarazada","Reparto, Produccion, Direccion",no info
38,Clarence Phillpot,No info,"Have You Seen Me?, No info, No info",Reparto,No ha ganado premios
39,Kevin Kilumbu,No info,"Ingenua inocencia, Insecure, Snowfall",Reparto,No ha ganado premios
40,Haley Brooke Newton,No info,"Un encargo muy especial, Hospital Head Doctor, No info",Reparto,no info
41,Yaroslav Kozak,1993,"Vedro, Komunalne, Nos","Reparto, Produccion, Vestuario",no info
42,Clarence Phillpot,No info,"Have You Seen Me?, No info, No info",Reparto,No ha ganado premios
43,Helen Chan,No info,"Quan jia fu, No info, No info",Reparto,No ha ganado premios
44,Samuel Hui,1948,"Swordsman, Mad Mission, La leyenda de la perla dorada","Reparto, Musica, Composicion",no info
45,Luis Alarcon,1929,"Estupido Cupido, La fiera, Tempano","Reparto, Efectos especiales, Produccion",4
46,Clarence Phillpot,No info,"Have You Seen Me?, No info, No info",Reparto,No ha ganado premios
47,Anthony Harrison,1961,"Joe Finds Grace, Somos los mejores: Una nueva era, Exuvia","Reparto, Produccion, Guion",2
48,Clarence Phillpot,No info,"Have You Seen Me?, No info, No info",Reparto,No ha ganado premios
49,John Goodman,1952,"Calle Cloverfield 10, Barton Fink, Argo","Reparto, Produccion, Banda sonora",33
50,Clarence Phillpot,No info,"Have You Seen Me?, No info, No info",Reparto,No ha ganado premios
51,Matt Damon,1970,"El indomable Will Hunting, Marte (The Martian), Infiltrados","Produccion, Reparto, Guion",40
52,Clarence Phillpot,No info,"Have You Seen Me?, No info, No info",Reparto,No ha ganado premios
53,Michael Pena,1976,"La gran estafa americana, Crash (Colision), Sin tregua","Reparto, Produccion, Banda sonora",13
54,Clarence Phillpot,No info,"Have You Seen Me?, No info, No info",Reparto,No ha ganado premios
55,Gladys Florence,No info,"Caravaggio and My Mother the Pope, No info, No info","Direccion, Reparto, Guion",no info
56,Clarence Phillpot,No info,"Have You Seen Me?, No info, No info",Reparto,No ha ganado premios
57,Rosario Dawson,1979,"Rent, Batman: La LEGO pelicula, Sin City: Ciudad del pecado","Reparto, Produccion, Direccion",16
58,Clarence Phillpot,No info,"Have You Seen Me?, No info, No info",Reparto,No ha ganado premios
59,Greg Lindsay,No info,"Dos buenos tipos, Patinazo a la gloria, Las Vegas","Reparto, Guion, Produccion",No ha ganado premios
60,John Ducey,1969,"Yo creo en Papa Noel, Bad Judge, Zack y Cody: La pelicula","Reparto, Guion, Produccion",No ha ganado premios
61,Rich Fulcher,1968,"The Mighty Boosh, Wonka, Snuff Box","Reparto, Produccion, Guion",no info
62,Victoria Crawford,No info,"Remnants, Folly of Man, In My Shoes","Reparto, Equipos adicionales",No ha ganado premios
63,Matt Williams,No info,"These Streets We Haunt, Nashville, Everyday Yeti","Reparto, Guion, Direccion",no info
64,Nicholas Riggall,No info,"Play-Time!, Eternal Harvest, Whiteblood","Reparto, Produccion",no info
65,Clarence Phillpot,No info,"Have You Seen Me?, No info, No info",Reparto,No ha ganado premios
66,Avtar Gill,1950,"Airlift, Dilwale, Veergati",Reparto,No ha ganado premios
67,Priyadarshan Jadhav,No info,"Choricha Mamla, Maska, Jaago Mohan Pyare","Reparto, Guion, Direccion",no info
68,Tamara Avramoska,No info,"First Kiss, No info, No info",Reparto,No ha ganado premios
69,Filip Kamnaroski,No info,"First Kiss, No info, No info",Reparto,No ha ganado premios
70,Aleksandar Kamnaroski,No info,"Godina majmuna, Oops, No info",Reparto,No ha ganado premios
71,Blagica Trpkovska,No info,"Kill the Children first, Do balcak, Godina majmuna",Reparto,No ha ganado premios
72,Mark Bodoky,No info,"Get Lost, Aurora Borealis: Eszaki feny, Engedetlen",Reparto,No ha ganado premios
73,Zoltan Ratoti,1960,"Europa expressz, Eletkepek, The Gravy Train Goes East",Reparto,no info
74,Tim Burleson,No info,"Excalibur Too, Burrito Tuesday!, Hamfisted",Reparto,No ha ganado premios
75,Calvin Henson Jr.,No info,"Alone in the Dark, All in the Family, Joe Haladin: The Case of the Missing Sister","Camara y electricidad, Reparto, Produccion",no info
76,Ricky Hunt,No info,"The Ballet Exam, The Sharpie, No info","Reparto, Guion",No ha ganado premios
77,Abbie Murphy,No info,"David Brent: Life on the Road, Pokemon: Detective Pikachu, The Stand Up Sketch Show","Reparto, Guion, Direccion",No ha ganado premios
78,Martavious Cerrone Gayles,No info,"American Idol: The Search for a Superstar, Padre Made in USA, The Orville","Reparto, Equipos adicionales, Guion",No ha ganado premios
79,Andres Uribe,No info,"The Wolf of Guacotle, No info, No info",Reparto,No ha ganado premios
80,Sarah McLean,no info,"Ley y orden: Crimen organizado, Little America, Defender a Jacob","Reparto, Guion, Produccion",No ha ganado premios
81,Nicole Serrat,No info,"Chatter, You Got the Part, Sonia","Reparto, Guion, Equipos adicionales",No ha ganado premios
82,Wenting Hao,No info,"Mei Gong he xing dong, Fairyland Lovers, Wo ke neng yu dao le jiu xing",Reparto,No ha ganado premios
83,Fangxi Shen,No info,"Shao nv tian shi, Re ai dao, Fen dou",Reparto,No ha ganado premios
84,Joshua Lino Da Costa,No info,"The Good, The Bad And The Tennis, No info, No info",Reparto,No ha ganado premios
85,Liam Kelleher,No info,"The Good, The Bad And The Tennis, No info, No info",Reparto,No ha ganado premios
86,Christian Colucci,No info,"Corazones en llamas, Piel de Lija, No Me Cazaras",Reparto,No ha ganado premios
87,Nina Isabel,No info,"UnHoly Father, No info, No info",Reparto,No ha ganado premios
88,Edwin R. Ruiz,No info,"Phil. The Film, Pancakes for President, Will there be Dancing on Mars?","Produccion, Camara y electricidad, Reparto",no info
